1816;29060719000108;FIA GEOLOGIA E PROSPECCAO MINERAL LTDA - R
1823;05512407000111;DALFA COMERCIO DE GESSO LTDA - R
1826;23598627000191;GODOI LIMPEZA E SERVICOS TERCEIRIZADOS LTDA
1830;33148648000169;DIVINA MARMITA LTDA
1831;33431304000162;UNIVALI DISTRIBUIDORA E COMERCIO LTDA
1832;03262660000139;VN7 COMUNICACAO E MARKETING LTDA
1833;07571785000100;ZAGO CALHAS LIMITADA
1834;10666377000138;PRADO & PANA COMERCIO DE ACESSORIOS PARA CELULARES LTDA
1838;23524163000179;TORRENTE & SILVA LTDA
1839;10369604000163;R. R. SIMOES UNIFORMES LIMITADA
1841;20396533000141;PROBIO LTDA
1844;12289030000300;ESTHER CASTRO PEDROSA
1845;10746458000148;LHF CONFECCOES LTDA
1847;28655026000197;K. R. DOS SANTOS GUARIENTE
1849;32922821000171;KANSAS BARBECUE LTDA
1852;10494957000195;TORREZIN INDUSTRIA E COMERCIO DE POLPAS DE FRUTAS CONGELADAS LIMITADA
1853;40797106000182;NOTRE PAIN PADARIA ARTESANAL LTDA
1855;02334529000177;GESTOCK LOGISTICA LTDA
1856;33899115000119;FREDERIK HENDRIK ANTONIUS GEUER - E
1857;10600194000110;T & N COMERCIO DE SORVETES E MILK SHAKES LIMITADA - R
1858;02120773000137;INSTRUCAMP INSTRUMENTOS DE MEDICAO LTDA
1863;43347668000112;VT PRODUTOS CIRURGICOS LTDA
1865;02274649000126;CM - INFORMATICA LTDA - E
1866;36281639000130;CARDELLA AUTOMATION LTDA - E
1869;26074271000185;FRANCA JUNIOR COMERCIO DE AR CONDICIONADO LTDA - E
1870;31532059000154;TEMPERO DO CHEFE RESTAURANTE LTDA - E
1872;17765036000169;RL ILUMINACAO LTDA
1873;16686026000175;GASLIVE IMPORTACAO E EXPORTACAO DE PRODUTOS MEDICOS LTDA
1874;10732971000180;CONGELAX DISTRIBUIDORA E LOGISTICA LTDA - R
1875;21546505000126;MAXI-AIR LTDA - R
1876;13032096000111;TXR PRODUTOS QUIMICOS LIMITADA - E
1877;10758908000112;MARCOS ANTONIO DE REZENDE LTDA
1878;24326629000194;PAULO CEZAR RIBEIRO
1884;12394240000105;CLAUDEMIR RIBEIRO JARDINAGEM - E
1887;11264436000104;RAIMUNDO EDEMILSON DA SILVA - E
1888;18688690000189;LOTERICA CENTO E ONZE LTDA - E
1889;08879550000134;LFF PIZZARIA E RESTAURANTE LTDA - E
1890;16656244000167;RODRIGUES BARBOSA & BARBOSA LTDA - E
1892;11333041000116;GMARC SOLUCOES EM TELECOMUNICACOES LTDA - E
1894;25132620000105;FABIO ANDRE DIAS - R
1898;34269358000136;C. A. AGUSTINHO EMBALAGENS LTDA - E
1899;12996973000101;E. N. PAULOSSI - E
1900;17765036000240;RL ILUMINACAO LTDA
1901;30679205000106;SILVA & GUARIENTE LTDA - R
1904;29591113000190;DELLAVIA PROJETOS E MANUTENCAO INDUSTRIAL LTDA - R
1905;18857530000116;TF COMERCIO DE ALIMENTOS LTDA - E
1907;67867648000130;PASSARELLI & PASSARELLI LTDA - E
1909;30738817000122;PILEGE MOVEIS PLANEJADOS LTDA - R
1913;24630222000156;MARIANE ELIAS GIL
1918;32180109000144;CAMILA ALVES SIQUEIRA GASTALDI
1924;36662999000181;MIXRECORTE EPS LTDA
1938;43145738000150;GLAUCIANE DA SILVA SOUZA CAMOLEZE
1939;28276869000182;ODONTO CLEAN - CLINICA ODONTOLOGICA VALINHOS LTDA
1940;43307608000176;A.M.F. RESTAURANTE LTDA
1946;11819449000100;HORTIFRUTI KANESHI LTDA
1949;71679195000196;DAMIAO PEREIRA DA SILVA GEMEO
1951;08251565000153;DANIELA ANDREUCETTI SOUZA
1952;13446999000149;ELISEU GUIMARAES SOUZA
1953;05943566000170;ESCOLA DE EDUCACAO INFANTIL MARI COSER LTDA
1954;20026029000150;ROTA DAS VINHAS TRANSPORTES LTDA
1955;03414820000118;FERNANDO DE SOUZA FOTO E OTICA LTDA
1957;05600866000157;G.F. MATERIAIS FOTOGRAFICOS LTDA
1959;07662528000175;HELENA SILVA RIBEIRO ALVES
1960;04887160000155;GIOVANNI THOMAZI SALAS & CIA LTDA.
1962;11827352000131;GLEG COMERCIAL LTDA
1965;62741996000143;IRMAS OGANEKU LTDA
1967;07981654000192;EXCELLFARMA DROGARIA LIMITADA - E
1968;62238332000166;HIDRAULICA PALHARES LTDA
1969;07103320000540;LUNNE COMERCIAL LTDA
1970;07103320000116;LUNNE COMERCIAL LTDA
1971;03234628000140;LUZIA DOS SANTOS SILVA JUNDIAI
1975;01377032000173;MEGAARC INDUSTRIAL, SOLDAGEM E SEGURANCA LTDA
1976;09357509000160;MFER INDUSTRIA E COMERCIO PECAS EM GERAL LTDA
1979;13173248000104;RAIMUNDO REGINALDO NUNES DE OLIVEIRA
1980;19918877000194;RICARDO NOBORU KOYAMA
1981;08794594000161;ROJERI INDUSTRIA E COMERCIO DE COMPONENTES DE METAIS LTDA
1982;09550333000169;SAKAI & FREITAS TRANSPORTES RODOVIARIOS LTDA
1986;32116240000142;CONNECTION PARTICIPACOES LTDA
1987;11555847000159;E. B. OLIVEIRA & OLIVEIRA LIMITADA
1988;11565092000173;DIGITAL TOOLS GRAFICA EXPRESSA LIMITADA
1989;32199327000120;CENTER FLORA IRRIGACAO E PAISAGISMO LTDA
1993;32384973000168;NICOLI ALEXSANDRA JULIO 41308289839
1999;08884847000198;VRI NEGOCIOS E PARTICIPACOES LTDA
2001;28354134000120;L. C. BERNARDINETTI LTDA
2005;25242185000171;VIC VICENTINI COMERCIO DE ALIMENTOS LTDA
2006;30148110000166;DAMARIA TORTAS ARTESANAIS LTDA
2008;13003456000157;BULULU - COMERCIO E SERVICOS DE PAISAGISMO LTDA.
2009;24140736000123;VNS ALIMENTOS LTDA
2011;33979330000120;LIQUOS AMBIENTAL EQUIPAMENTOS E SISTEMAS PARA SANEAMENTO BASICO AMBIENTAL LTDA
2012;24290783000153;SONHO LAR COLCHOES LTDA - E
2013;32885067000147;MICHELLA FERNANDO DE ARAUJO
2016;24310270000167;QUALINOX MONTAGEM E MANUTENCAO INDUSTRIAL LTDA
2017;24528264000180;EL LOCACAO DE AUTOMOVEIS VALINHOS LTDA
2019;10267974000190;LEBRE COMERCIO DE ALIMENTOS LTDA
2021;11686668000150;PERFI SOLO FUNDACOES LTDA
2023;21864429000105;F. T. FIGUEIREDO FISIOTERAPIA EIRELI
2026;27648034000143;RBL CLINICA MEDICA LTDA
2027;20221022000199;CLINICA MEDICA MARINA PARRILLA S/S
2028;22813534000170;PADARIA DA CIDADE LTDA
2029;11763214000136;INFOVALI INFORMATICA LTDA
2031;24123835000105;GUALIS LOGISTICA E SERVICOS AUXILIARES DE TRANSPORTES AEREOS LTDA
2033;11790081000197;JOSE FRANCINALDO DA COSTA
2035;37355240000119;MB LASER INFORMATICA LTDA
2036;57958316000108;LET' S SWIM, NATACAO,PRESENTES E LANCHES LTDA
2037;11811861000176;EDSON MAXIMOVITCH
2041;05015368000147;TRANSVIVA TRANSPORTES DE VALINHOS LTDA
2046;36407874000105;PRIME TRAFFOS GESTAO TECNICA E EMPRESARIAL LTDA
2048;69150142000131;COMERCIO DE FRUTAS CATELLI & KOTAKA LTDA
2051;35056466000193;INCERAMIC MAQUINAS E EQUIPAMENTOS CERAMICOS LTDA
2054;02894995000450;TANAKAO PET SHOP PRODUTOS AGROPECUARIOS LTDA
2055;07135152000221;QUALY SERVICE INDUSTRIA E SERVICOS LTDA
2056;16979822000104;FABENE ALIMENTOS LTDA
2057;35032073000140;CG CENTRO DE TRATAMENTO ESTETICO LTDA
2059;16896203000148;SMART CLICHERIA LTDA
2060;28075753000185;LANZONI & PASSUCCI S/S LTDA
2064;15674611000192;FLA SERVICOS ADMINISTRATIVOS LIMITADA
2067;12352344000149;L B REFLETIVOS INDUSTRIA E COMERCIO LTDA
2068;18813070000205;GUSTAVO GABRIEL GUARIENTE PAIVA LTDA
2071;14763956000150;FH MONTAGEM E MANUTENCAO INDUSTRIAL LTDA
2072;23113959000139;GIANFAGNA & MARCHI LTDA - R
2074;33547061000122;PLASNAN INDUSTRIA E COMERCIO DE PRODUTOS PLASTICOS LTDA - E
2078;01538188000199;SANCHEZ & TEMPLE AUTOMACAO INDUSTRIAL LTDA - E
2081;03066013000151;S.T.E.CORRETORA DE SEGUROS LTDA.
2082;27391046000135;GWA WATER SISTEMAS E EQUIPAMENTOS PARA SANEAMENTO LTDA
2083;13295913000124;MARLON RESTAURANTES LTDA
2085;30450392000151;KAIROS HOSPITALAR DISTRIBUIDORA DE MEDICAMENTOS LTDA
2087;12225882000172;CLAUDINEI DONIZETE DOS ANJOS DA SILVEIRA
2089;03003737000156;CAMPTOSA PRESTACAO DE SERVICOS PARA ANIMAIS LTDA - E
2092;41104535000190;BTZ FAST FOOD LTDA
2100;12289030000149;ESTHER CASTRO PEDROSA -E
2105;08408525000172;VIDENCE FUNILARIA E PINTURA LTDA
2106;10605880000183;PESQUEIRO DA XUXA E DO BAIANO LTDA
2108;27767654000100;C. E. DE BARROS SERVICOS AUTOMOTIVOS
2110;10980060000171;KEKIS & MACHADO LIMITADA - R
2112;29874305000104;TERRACOM TERRAPLENAGEM LTDA
2113;40693114000189;KONTENA COZINHA JAPONESA LTDA - E
2117;38807046000190;LUIZ ANTONIO AGIESSI VALINHOS - E
2123;05643055000133;RITA DE CASSIA ABREU SIGNORETTI - E
2124;10983224000114;DRAW TECNOLOGIA AUTOMACAO LTDA
2128;26446297000107;MECANICA CR LTDA - R
2136;15623892000154;CONCREMAX CONCRETEIRA EIRELI
2137;26473863000170;S. A. NUTRICAO CORPORATIVA LTDA
2140;22659669000122;ORM COMERCIO DE ALIMENTOS EIRELI
2141;35764278000110;ROCHEDO ELETRICIDADE LTDA
2142;01548059000181;JACLOG LTDA
2143;42045530000104;FERREIRA E JESUS LAVANDERIA LTDA
2145;05891181000107;FERNANDES VIEIRA & VIEIRA LTDA - E
2147;01820757000194;PAULO SERGIO RIGUETI VALINHOS - E
2148;29911210000113;FX-JPA REPRESENTACOES LTDA - E
2149;00839113000185;E L ZORDAN REPRESENTACOES COMERCIAIS LTDA
2150;09308634000180;SAMPAIO & OLIVEIRA SOUSA LIMITADA - E
2151;05251917000182;SACOLAO VALADARES LTDA - E
2154;53433223000109;PERSOAP INDUSTRIA E COMERCIO DE COSMETICOS LTDA
2155;12706668000138;SILVEIRA & GUEDES DA SILVEIRA LIMITADA
2156;00456472000153;DIAS PEREIRA DROGARIA LTDA
2158;01921012000111;PANIFICADORA E CONFEITARIA VITORIA REGIA VALINHOS LTDA
2159;43185180000136;CASAGRANDE AUTOPECAS LTDA
2162;08308555000107;INSTITUTO BIOPHYTIS DO BRASIL SERVICOS, COMERCIO, IMPORTACAO E EXPORTACAO DE ALIMENTOS LTDA.
2164;10656172000171;PANIFICADORA E CONFEITARIA BONANGE LTDA - E
2169;13132051000119;LUCIANO RIBEIRO MENDES
2171;26887549000133;JAPAN CENTER DECOR CAMPINAS LTDA
2172;14603261000100;BUCHI BRASIL LTDA.
2175;26907819000120;L. C. BIJUTERIAS LTDA
2176;05601293000186;LET S FISIOTERAPIA LTDA
2177;22029682000106;ESCOLA DE EDUCACAO INFANTIL GIZ COLORE LTDA
2180;14981581000102;JARDIM DAS PEDRAS LTDA
2181;02310481000248;DRUCK CHEMIE BRASIL LTDA
2182;19937772000182;MARCELO EICHI KAWAGUCHI
2184;01608071000134;RAPIDO VINHEDO LTDA
2185;29667864000143;RESTAURANTE RANCHO ARIZONA LTDA
2186;37356576000104;INOVA COMERCIO E REPRESENTACAO LTDA
2188;28353492000118;DROGARIA FARMA TOP EIRELI
2189;30659586000161;GM FERRAMENTARIA E PLASTICOS - EIRELI
2190;28462813000112;JP CARNES LTDA
2196;07555414000126;PREVENTIVA BUSINESS CORRETORA DE SEGUROS LTDA.
2197;17217679000178;KRSG COMERCIO DE ACESSORIOS PARA CELULAR EIRELI
2198;18813070000124;GUSTAVO GABRIEL GUARIENTE PAIVA LTDA
2200;19108637000124;JANGLEI SILVA DE SANTANA EIRELI
2204;12289030000220;ESTHER CASTRO PEDROSA
2205;10897400000103;OURO VERDE IDIOMAS E COMERCIO DE LIVROS DIDATICOS LTDA
2208;11461228000103;VAL COMERCIO DE SALGADOS LIMITADA
2209;13386929000142;INNOVATE TECHNOLOGIES DO BRASIL MAQUINAS E FERRAMENTAS LTDA - E
2210;13296548000172;STYROTECH INDUSTRIA E COMERCIO DE EPS EIRELI
2216;05677536000160;TRANSPORTE E LOGISTICA SANTA ISABEL LTDA
2217;11218991000108;PHILOS GLOBAL SERVICES LTDA
2221;20089999000102;VITA PET FABRICACAO DE PRODUTOS ALIMENTICIOS PARA ANIMAIS LTDA
2223;13535765000178;SSI EQUIPAMENTOS INDUSTRIAIS LIMITADA
2225;13741886000176;LANDO ELETRO - ACUSTICA SOCIEDADE LTDA - E
2226;20902584000106;ORTR METALURGICA EIRELI
2228;13771257000199;CLINICA MEDICA MANENTE LIMITADA
2229;41715278000122;J. SILVA DE SANTANA LTDA - R
2232;19901538000103;FLAVIANE DELA MARTA MORAES
2238;43290980000117;CAMPAL FRUTAS E LEGUMES LTDA
2239;43290980000206;CAMPAL FRUTAS E LEGUMES LTDA
2240;37610554000110;PRINCESA GALLERIA COMERCIO DE ALIMENTOS LTDA
2241;37257605000172;JF DESCARTAVEIS LIMITADA
2242;20064862000195;M. GUARIENTE
2246;37611224000140;STARGLASS ESQUADRIAS DE ALUMINIO LTDA
2247;55656094000143;TELEFONIA VALINHOS LTDA
2249;20269404000192;POLIS & AMPARO LTDA
2250;13846739000160;TS PHARMA SOLUCOES FARMACEUTICAS LTDA
2251;61074951000108;PADARIA E CONFEITARIA BIANCALANA LTDA
2253;07312502000105;LARISSA CAROLINA DOS SANTOS
2254;20330739000179;OLIVEIRA MOVEIS PLANEJADOS LTDA
2257;35373366000190;PAGANI DE CASTRO & BORIN LTDA
2258;24033697000165;J FERREIRA DISTRIBUIDORA LTDA
2259;20261084000124;MGT EMPREENDIMENTOS IMOBILIARIOS LTDA
2260;25190202000174;SS MOBILIDADE LTDA
2263;72819089000123;S. SABAS LOCADORA DE VEICULOS EIRELI
2264;13801523000189;SALES ALVES PIZZARIA EIRELI
2265;36112559000150;CESARINI LIMA RESTAURANTE LTDA
2269;13848758000126;HUDIEZE TECNOLOGIA DE CONTROLE LTDA
2270;01067513000182;CENTRO DE FORMACAO DE CONDUTORES AMERICA LTDA
2273;13863838000150;SILVA ZANARDI & ZANARDI LTDA
2276;20461861000184;V8 BARBER SHOP BARBEARIA LTDA
2277;36266228000175;ESTACAO PET CLINICA VETERINARIA LTDA
2279;38073351000103;NXD TECNOLOGIA E COMERCIO LTDA
2280;13959054000120;ZUMM ZUE BUFFET LIMITADA
2282;20302930000107;TLG MONTAGEM INDUSTRIAL LTDA
2283;39943099000109;CLAUDIA ROBERTA VEIGA SOCIEDADE INDIVIDUAL DE ADVOCACIA
2285;28989619000190;ORIGEM VEGANA INDUSTRIA E COMERCIO DE ALIMENTOS LTDA
2288;29060976000131;KFSN ARTES MARCIAIS LTDA
2290;27073206000106;VALIGLASS ESQUADRIAS DE ALUMINIO LTDA
2294;29112317000100;TERCEIRIZA COSMETICOS LTDA
2296;36650175000191;ODONTOGIMA CLINICA ODONTOLOGICA LTDA
2297;12254411000192;VINICIUS DIOGO TIBURCIO
2298;36609141000153;STG PISOS INTERTRAVADOS LTDA
2306;13120792000180;MOONWEB SOLUCOES DIGITAIS LTDA
2315;53748042000171;MAXQUALY - COMERCIO E LOGISTICA DE COSMETICOS - EIRELI
2318;20732835000143;ESPACO VINHEDO COMERCIO DE ALIMENTOS LTDA
2324;29438813000140;BRASIL CAPAS COMERCIO E DISTRIBUICAO DE EQUIPAMENTOS PARA PISCINAS LTDA
2326;05968652000138;SARCOMPY COMERCIO E SERVICOS DE PRODUTOS DE ELETRONICOS LTDA
2327;21609002000152;DEBEC CARGO - TRANSPORTES RODOVIARIO DE CARGAS EM GERAL EIRELI
2331;39372003000191;ESCAVA SOLO FUNDACOES E TERRAPLENAGEM LTDA
2338;29753676000138;VICTOR LUIZ BERSAN
